{
  "schema_version": "1.0",
  "data_mode": "fixture",
  "forecast_hour": "2026-03-08T08:00:00Z",
  "generated_at": "2026-03-08T07:00:00Z",
  "model_version": "mock-model-v1",
  "feature_version": "mock-features-v1",
  "input_revision": "mock-weather-v1",
  "grid_version": "mock-ca-grid-3km-v1",
  "grid_resolution_m": 3000,
  "score_type": "relative_risk",
  "target_type": "mock_fire_activity",
  "predictions": [
    {
      "cell_id": "MOCK_CA_000",
      "risk_score": 0.72
    },
    {
      "cell_id": "MOCK_CA_001",
      "risk_score": 0.38
    }
  ]
}
